{
  "state": "executed",
  "invocationId": "11111111-1111-4111-8111-111111111111",
  "terminalReceiptId": "22222222-2222-4222-8222-222222222222",
  "containerId": "1111111111111111111111111111111111111111111111111111111111111111",
  "stdoutSha256": "2222222222222222222222222222222222222222222222222222222222222222",
  "conformance": "valid",
  "workerState": "captured",
  "evidenceAccepted": false
}
